id;user_id;category_id;title;post_content;slug_post;post_image;status_id;view_count;created_at_post;updated_at_post
49;31;6;Getting Started with WordPress;WordPress is a powerful Content Management System (CMS) used by millions of websites. Learn how to set up and manage your own WordPress site. WordPress provides a user-friendly interface for creating and managing content, making it accessible to users with varying levels of technical expertise. Themes and plugins extend the functionality and appearance of a WordPress site, allowing for customization and feature enhancements. Setting up a WordPress site involves choosing a hosting provider, installing WordPress, and configuring basic settings such as permalinks, themes, and plugins. Understanding how to use the WordPress editor, manage media, and organize content with categories and tags helps in maintaining a well-structured site. Regular updates and security practices ensure that your WordPress site remains secure and performs optimally.;getting-started-with-wordpress;wordpress.jpg;1;71;2024:06:10 13:28;2024:06:10 13:28
50;1;7;Making Your Website Accessible;Accessibility ensures that your website can be used by everyone, including people with disabilities. Learn how to make your website more accessible. Web accessibility involves implementing various techniques and best practices to ensure that all users, regardless of their abilities, can navigate and interact with your site. This includes providing text alternatives for non-text content, such as images and videos, using ARIA (Accessible Rich Internet Applications) roles and properties to enhance the accessibility of web applications, and ensuring that all interactive elements are keyboard accessible. Additionally, maintaining a high contrast ratio between text and background colors improves readability for users with visual impairments. Conducting regular accessibility audits using tools like WAVE or Axe can help identify and address accessibility issues, ensuring compliance with standards such as WCAG (Web Content Accessibility Guidelines).;making-your-website-accessible;accessibility.jpg ;1;44;2024:06:12 12:03;2024:06:12 12:03
51;9;8;Getting Started with Laravel;Laravel is a PHP framework for web artisans. It provides an elegant syntax and tools to make web development faster and easier. Learn how to get started with Laravel. Laravel simplifies many common tasks, such as routing, authentication, and caching, allowing developers to focus on building robust applications. The framework follows the MVC (Model-View-Controller) architectural pattern, promoting separation of concerns and code reusability. Laravel's powerful ORM (Object-Relational Mapping) tool, Eloquent, provides an intuitive and expressive syntax for interacting with databases. Additionally, features like Blade templating engine, built-in task scheduling, and queue management make Laravel a comprehensive solution for web development. The extensive documentation and active community support also make it easier for developers to learn and troubleshoot issues.;getting-started-with-laravel;laravel.png;1;107;2024:06:20 16:10;2024:06:20 16:10
52;10;11;Optimizing Web Performance;Web Performance Optimization (WPO) involves improving the speed at which web pages are downloaded and displayed on the user's web browser. Learn techniques to optimize web performance. Key strategies for WPO include minimizing HTTP requests by combining files and using CSS sprites, optimizing images by compressing them without losing quality, and leveraging browser caching to reduce load times for returning visitors. Implementing lazy loading for images and videos ensures that only the content visible in the viewport is loaded initially, improving the initial page load speed. Additionally, using content delivery networks (CDNs) can distribute content geographically closer to users, reducing latency. Monitoring performance with tools like Google Lighthouse, WebPageTest, and GTmetrix helps identify bottlenecks and provides actionable insights for further optimization.;optimizing-web-performance;web-performance.jpg;1;111;2024:06:27 09:40;2024:06:27 11:29
53;27;13;SEO Best Practices;Search Engine Optimization (SEO) is the practice of increasing the quantity and quality of traffic to your website through organic search engine results. Learn the best practices for SEO. Effective SEO involves optimizing both on-page and off-page elements. On-page SEO includes optimizing meta tags, headings, and content with relevant keywords, ensuring a mobile-friendly design, and improving site speed. Creating high-quality, valuable content that addresses the needs and queries of your audience is crucial for ranking well in search engines. Off-page SEO focuses on building backlinks from reputable websites, which signals to search engines that your site is authoritative and trustworthy. Regularly updating content, using schema markup for rich snippets, and monitoring performance with tools like Google Analytics and Search Console are essential practices for maintaining and improving SEO performance.;seo-best-practices;seo.png;1;88;2024:06:30 17:32;2024:06:30 17:32
54;6;1;Advanced PHP Techniques;Learn advanced techniques in PHP to build more efficient and powerful web applications. Advanced PHP techniques include using design patterns such as Singleton, Factory, and Observer to write more organized and maintainable code. Understanding and implementing dependency injection can enhance the flexibility and testability of your applications. Additionally, leveraging PHP's built-in functions and features, such as generators for handling large datasets and closures for creating anonymous functions, can improve performance and efficiency. Security best practices, such as input validation, sanitization, and using prepared statements for database interactions, help protect your applications from common vulnerabilities. Exploring PHP extensions and libraries, such as PHPUnit for testing and Guzzle for HTTP requests, can further enhance your development process.;advanced-php-techniques;php-advanced.png;1;52;2024:07:01 09:00;2024:07:01 09:00
55;10;13;Local SEO Strategies;Implement local SEO strategies to improve your business's visibility in local search results. Local SEO focuses on optimizing your online presence to attract more business from relevant local searches. Key strategies include claiming and optimizing your Google My Business listing, ensuring your name, address, and phone number (NAP) are consistent across all online directories, and encouraging satisfied customers to leave positive reviews. Creating locally relevant content, such as blog posts about community events or local news, can also help improve your local search rankings. Additionally, optimizing your website for mobile devices and ensuring fast load times are crucial, as many local searches are conducted on mobile phones. Monitoring and analyzing your local SEO performance with tools like Moz Local and BrightLocal helps identify areas for improvement and track your progress.;local-seo-strategies;local-seo.jpg;1;93;2024:07:03 11:45;2024:07:03 15:30
56;18;6;Managing Content with Joomla;Discover how to manage content effectively using Joomla, a popular CMS. Joomla is a flexible and powerful content management system that allows you to build and manage a wide range of websites, from simple blogs to complex corporate portals. It offers a user-friendly interface for creating and organizing content, with features like content versioning, nested categories, and tagging. Joomla's extensive library of extensions and templates enables you to add functionality and customize the design of your site easily. The built-in multilingual support allows you to create content in multiple languages, reaching a broader audience. Additionally, Joomla's robust access control system lets you manage user permissions and roles, ensuring secure content management.;managing-content-with-joomla;joomla.jpg;1;84;2024:07:06 15:15;2024:07:06 15:15
57;32;12;Advanced State Management with Redux;Master advanced state management techniques in Redux for large-scale applications. Redux is a predictable state container for JavaScript applications, often used with libraries like React to manage application state. Advanced techniques in Redux include using middleware such as Redux Thunk or Redux Saga to handle asynchronous actions and side effects. Normalizing your state structure can help avoid deeply nested state trees and improve performance. Leveraging selector libraries like Reselect allows you to create memoized selectors, which optimize state-derived computations. Implementing a modular architecture with Redux allows for better scalability and maintainability of your codebase. By mastering these techniques, you can effectively manage complex state logic in your large-scale applications.;advanced-state-management-with-redux;redux.png;1;85;2024:07:10 10:30;2024:07:10 13:25
58;14;10;Optimizing Database Queries;Learn techniques for optimizing database queries to improve application performance. Optimizing database queries involves analyzing and improving the efficiency of SQL statements to reduce execution time and resource consumption. Key techniques include indexing frequently queried columns to speed up data retrieval, avoiding unnecessary columns in SELECT statements, and using JOINs instead of subqueries where appropriate. Analyzing query execution plans helps identify bottlenecks and areas for improvement. Additionally, implementing caching strategies, such as query caching and result caching, can reduce the load on the database and improve response times. Regularly monitoring database performance with tools like MySQL EXPLAIN and pgAdmin ensures that your queries remain efficient as your dataset grows.;optimizing-database-queries;database-queries.jpg;1;75;2024:07:12 09:15;2024:07:12 09:15
59;18;15;Monitoring Applications with Prometheus;Learn how to monitor your applications and infrastructure using Prometheus, an open-source monitoring and alerting toolkit. Prometheus collects metrics from configured targets at specified intervals, stores them efficiently, and provides powerful querying capabilities. Setting up Prometheus involves configuring targets and exporters to collect metrics from various sources, such as application servers, databases, and hardware devices. Using PromQL, Prometheus's query language, you can create complex queries to analyze and visualize metrics data. Integrating Prometheus with Grafana allows you to create interactive and customizable dashboards for real-time monitoring. Setting up alerting rules in Prometheus ensures that you are notified of critical issues promptly, enabling proactive management of your applications and infrastructure.;monitoring-with-prometheus;prometheus.jpg;1;88;2024:07:14 15:30;2024:07:14 18:51
60;31;8;Vue.js for Dynamic Interfaces;Use Vue.js to build dynamic and reactive user interfaces for your web applications. Vue.js is a progressive JavaScript framework that provides an approachable and flexible architecture for building interactive web applications. Its reactive data binding system allows for efficient and seamless updates to the DOM when the underlying data changes. Vue's component-based structure promotes code reusability and modularity, making it easier to manage complex applications. Advanced features such as Vue Router for managing application routes and Vuex for state management provide a comprehensive solution for single-page applications (SPAs). By mastering Vue.js, you can create responsive and performant user interfaces that enhance the user experience.;vuejs-dynamic-interfaces;vuejs.png;1;96;2024:07:16 15:30;2024:07:23 15:30
