id;user_id;category_id;title;post_content;slug_post;post_image;status_id;view_count;created_at_post;updated_at_post
21;28;8;Using Django for Web Development;"Learn how to use Django, a powerful web framework, for building robust web applications. Django is a high-level Python web framework that encourages rapid development and clean, pragmatic design. It follows the ""batteries-included"" philosophy, providing a wide range of built-in features such as an ORM (Object-Relational Mapping), authentication, and a customizable admin interface. These features help developers focus on writing their applications instead of reinventing the wheel. Additionally, Django follows the MVC (Model-View-Controller) pattern, which promotes separation of concerns and code reusability. By mastering Django, you can efficiently build secure, scalable, and maintainable web applications.";using-django-for-web-development;django.jpg;1;93;2024:01:30 11:42;2024:01:30 15:10
22;37;9;Testing with Jest;Jest is a delightful JavaScript testing framework with a focus on simplicity. It provides a robust set of features, including a built-in assertion library, support for mocking, and powerful tools for writing asynchronous tests. Jest's zero-configuration setup makes it easy to start testing immediately, while its snapshot testing feature allows developers to capture the rendered output of components and compare them over time. This helps ensure that the UI remains consistent and free of unintended changes. Additionally, Jest's interactive watch mode provides instant feedback during development, enhancing the developer experience and encouraging a test-driven development (TDD) approach.;testing-with-jest;jest.png;1;58;2024:02:05 10:11;2024:02:05 10:11
23;33;14;Using GraphQL with Apollo;Apollo Client is a comprehensive state management library for JavaScript that enables you to manage both local and remote data with GraphQL. It simplifies data fetching, caching, and synchronization with your GraphQL server, providing a declarative way to interact with your data. Apollo Client integrates seamlessly with modern frameworks like React, Angular, and Vue.js, allowing you to fetch data using GraphQL queries directly within your components. By leveraging Apollo Client's features, such as optimistic UI updates and pagination support, you can create responsive and performant applications that provide a smooth user experience. Additionally, Apollo Client's built-in developer tools make it easy to debug and monitor your GraphQL operations.;using-graphql-with-apollo-client;apollo-client.jpg;1;78;2024:02:09 13:25;2024:02:09 13:25
24;1;15;Infrastructure as Code with Terraform;Learn how to use Terraform to manage your infrastructure as code. Terraform is an open-source infrastructure as code (IaC) tool that allows you to define and provision your infrastructure using a declarative configuration language. By using Terraform, you can automate the creation, modification, and deletion of resources across multiple cloud providers, such as AWS, Azure, and Google Cloud. This ensures consistency and repeatability in your infrastructure deployments. Terraform's state management feature keeps track of the current state of your infrastructure, enabling you to apply incremental changes safely. Additionally, Terraform supports a wide range of providers and modules, allowing you to extend its functionality and integrate with other tools in your DevOps toolkit.;infrastructure-as-code-with-terraform;terraform.png;1;86;2024:02:12 14:15;2024:02:12 14:15
25;20;5;Applying Web Security Protocols;Understand and implement essential web security protocols to protect your applications. Web security protocols are crucial for safeguarding sensitive data and ensuring the integrity and confidentiality of your web applications. Protocols such as HTTPS (Hypertext Transfer Protocol Secure) encrypt data transmitted between the client and server, preventing eavesdropping and man-in-the-middle attacks. Implementing security headers like Content Security Policy (CSP) and HTTP Strict Transport Security (HSTS) can further enhance the security of your application by mitigating risks like cross-site scripting (XSS) and protocol downgrade attacks. Additionally, using multi-factor authentication (MFA) and secure password storage practices helps protect user accounts from unauthorized access.;applying-web-security-protocols;web-security.jpg;1;77;2024:02:20 14:46;2024:02:20 14:46
26;12;3;Effective UX Prototyping;Learn how to create effective prototypes to improve the user experience of your web applications. Prototyping is an essential step in the design process that allows you to visualize and test your ideas before committing to development. By creating interactive prototypes, you can gather feedback from stakeholders and users early in the design process, identifying potential issues and areas for improvement. Tools like Sketch, Figma, and Adobe XD offer a range of features for designing and prototyping user interfaces, including interactive elements, animations, and collaborative editing. Effective prototyping helps ensure that the final product meets user needs and expectations, reducing the risk of costly redesigns and rework.;effective-ux-prototyping;ux-prototyping.png;1;72;2024:02:25 11:30;2024:02:25 11:30
27;9;4;Styling with Tailwind CSS;Explore how to use Tailwind CSS to style your web applications quickly and efficiently. Tailwind CSS is a utility-first CSS framework that provides low-level utility classes for building custom designs without writing CSS from scratch. By using utility classes directly in your HTML, you can create responsive and consistent designs more rapidly than with traditional CSS frameworks. Tailwind's configurability allows you to customize its default theme, breakpoints, and spacing scale to match your project's design requirements. Additionally, Tailwind's JIT (Just-In-Time) mode generates only the necessary CSS for your project, reducing the final bundle size and improving performance. With Tailwind CSS, you can achieve a high degree of design flexibility while maintaining a consistent and maintainable codebase.;styling-with-tailwind;tailwind.jpg;1;65;2024:02:28 12:45;2024:02:28 16:28
28;23;2;Git Workflow Best Practices;Master the best practices for using Git to manage your project's version control effectively. Git is a distributed version control system that allows multiple developers to collaborate on a project simultaneously. Following best practices such as writing meaningful commit messages, using branches to isolate feature development, and performing regular code reviews can improve collaboration and code quality. Understanding how to use Git commands like rebase, merge, and cherry-pick enables you to manage your commit history and resolve conflicts efficiently. Additionally, integrating Git with CI/CD pipelines automates testing and deployment processes, ensuring that your codebase remains stable and reducing the risk of introducing bugs into production.;git-workflow-best-practices;git-workflow.jpg;1;89;2024:03:02 10:15;2024:03:02 10:15
29;10;15;Implementing Continuous Integration;Implement continuous integration (CI) to streamline your development workflow. Continuous integration is a development practice where developers frequently integrate their code changes into a shared repository, triggering automated builds and tests. By adopting CI, you can detect and address issues early, ensuring that your codebase remains stable and reducing the time spent on manual testing. Tools like Jenkins, Travis CI, and GitHub Actions provide a range of features for setting up and managing CI pipelines, including support for various programming languages, integration with version control systems, and customizable workflows. Implementing CI helps improve code quality, accelerate development cycles, and enable more frequent releases.;implementing-continuous-integration;ci.jpg;1;79;2024:03:05 15:30;2024:03:05 15:30
30;24;4;Sass: Advanced Techniques;Master advanced techniques in Sass to write more efficient and maintainable CSS. Sass (Syntactically Awesome Style Sheets) extends CSS with features like variables, nested rules, and mixins, which help in writing cleaner and more modular code. Advanced techniques in Sass include the use of functions and loops to create dynamic styles and avoid code repetition. By leveraging these features, you can create a more maintainable and scalable stylesheet architecture. Additionally, understanding the importance of partials and imports in Sass can help you organize your stylesheets better, making it easier to manage large projects. Using Sass with a CSS preprocessor like Node-sass or Dart-sass allows for faster compilation and better integration with build tools like Gulp or Webpack.;sass-advanced-techniques;sass.jpg;1;83;2024:03:10 11:44;2024:03:10 13:30
31;24;11;Web Performance Audits;Conduct web performance audits to identify and fix performance bottlenecks. A web performance audit involves analyzing various aspects of a website to determine what is slowing it down and how to optimize it. Key areas to focus on include loading times, render blocking resources, and inefficient scripts. Tools like Google Lighthouse, WebPageTest, and GTmetrix provide detailed insights into performance metrics and recommendations for improvement. Optimizing images, leveraging browser caching, and minifying CSS and JavaScript files are common techniques to enhance performance. Regularly conducting performance audits ensures that your website remains fast and responsive, providing a better user experience and improving search engine rankings.;web-performance-audits;performance-audit.jpg;1;74;2024:03:16 15:51;2024:03:16 15:51
32;4;15;Introduction to Docker;"Docker is a tool designed to make it easier to create, deploy, and run applications by using containers. Containers package an application and its dependencies together, ensuring that it runs consistently across different environments. Docker simplifies the deployment process by eliminating the ""it works on my machine"" problem, as the containerized application behaves the same way in development, testing, and production environments. Advanced Docker usage includes creating multi-container applications using Docker Compose, optimizing Dockerfiles for faster builds, and implementing CI/CD pipelines with Docker to automate the deployment process. By mastering Docker, you can improve your development workflow, enhance application portability, and achieve better resource utilization.";introduction-to-docker;docker-tool.png;1;125;2024:03:22 08:11;2024:03:22 08:11
33;6;2;Branching Strategies in Git;Explore different branching strategies in Git to manage your codebase efficiently. Effective branching strategies are crucial for maintaining a clean and organized codebase, especially in large projects with multiple contributors. Common strategies include Git Flow, which uses long-lived branches for development and production, and feature branching, where each new feature is developed in its own branch. Understanding when to use rebase versus merge is also important for maintaining a linear commit history and avoiding merge conflicts. Implementing a well-defined branching strategy helps in coordinating development efforts, reducing integration issues, and ensuring a smooth workflow for continuous integration and deployment.;branching-strategies-in-git;git-branching.png;1;68;2024:03:27 18:00;2024:03:27 18:00
34;37;3;Enhancing UX with Microinteractions;Use microinteractions to enhance the user experience of your web applications. Microinteractions are subtle, often overlooked elements that enhance user interactions with a product. They provide feedback, communicate status, and help users achieve their goals with less friction. Examples include button animations, hover effects, and form validations. Implementing effective microinteractions involves understanding the context of their use and ensuring they are consistent with the overall design language. Tools like CSS animations, JavaScript, and libraries like Lottie can be used to create engaging microinteractions. When done correctly, microinteractions can make your web application feel more intuitive and responsive, improving user satisfaction and engagement.;enhancing-ux-with-microinteractions;microinteractions.jpg;1;72;2024:04:02 09:15;2024:04:02 09:15
35;1;13;SEO for E-commerce Sites;Optimize your e-commerce site for search engines to increase traffic and sales. E-commerce SEO involves optimizing product pages, category pages, and the overall site structure to improve visibility in search engine results. Key strategies include keyword research to identify relevant search terms, optimizing meta tags and descriptions, and ensuring fast load times. High-quality product descriptions and user-generated content like reviews also contribute to better rankings. Additionally, implementing schema markup can enhance search engine understanding of your content and improve click-through rates with rich snippets. Regularly monitoring and analyzing your SEO performance with tools like Google Analytics and Search Console helps in making data-driven decisions and staying ahead of the competition.;seo-for-e-commerce-sites;seo-ecommerce.jpg;1;109;2024:04:11 13:22;2024:04:11 13:22
36;38;14;GraphQL vs REST;GraphQL is a query language for APIs, while REST is an architectural style for networked applications. Compare the two. GraphQL allows clients to request exactly the data they need, reducing the number of API calls and the amount of data transferred. It uses a single endpoint and supports real-time data fetching with subscriptions. REST, on the other hand, uses multiple endpoints and standard HTTP methods for CRUD operations. While REST is simple and widely adopted, GraphQL provides more flexibility and efficiency, especially in complex applications. Choosing between GraphQL and REST depends on the specific requirements of your project, such as the need for real-time updates, the complexity of data relationships, and the preferred development workflow.;graphql-vs-rest;graphql-vs-rest.jpg;1;35;2024:04:18 15:54;2024:04:19 09:10
37;14;7;Improving Website Accessibility;Implement strategies to improve the accessibility of your website. Web accessibility ensures that websites are usable by people with disabilities, providing equal access to information and functionality. Key strategies include using semantic HTML elements to improve screen reader compatibility, providing text alternatives for non-text content, and ensuring sufficient color contrast. Implementing keyboard navigation and making interactive elements accessible helps users with motor impairments. Additionally, conducting accessibility audits using tools like WAVE and Lighthouse, and following guidelines from the Web Content Accessibility Guidelines (WCAG), ensures compliance and identifies areas for improvement. Improving accessibility not only benefits users with disabilities but also enhances the overall user experience and SEO.;improving-website-accessibility;accessibility-improvement.png;1;61;2024:04:22 14:15;2024:07:22 14:15
38;12;10;Understanding NoSQL Databases;NoSQL databases provide a mechanism for storage and retrieval of data that is modeled in means other than the tabular relations used in relational databases. They are designed to handle large volumes of unstructured or semi-structured data and offer flexible schema designs. Common types of NoSQL databases include document databases like MongoDB, key-value stores like Redis, column-family stores like Cassandra, and graph databases like Neo4j. Each type is suited to different use cases, such as real-time analytics, content management, and social networking. NoSQL databases often provide horizontal scalability, allowing them to handle large-scale, high-traffic applications efficiently. Understanding the strengths and limitations of different NoSQL databases helps in choosing the right one for your application's needs.;understanding-nosql-databases;nosql.jpg;1;70;2024:04:29 11:45;2024:04:29 11:45
39;33;15;Introduction to Kubernetes;Kubernetes is an open-source system for automating the deployment, scaling, and management of containerized applications. It provides a robust platform for running containers in production, handling tasks such as service discovery, load balancing, and automatic rollouts and rollbacks. Kubernetes uses a declarative approach to manage infrastructure, allowing developers to define the desired state of the application and let the system maintain it. Features like namespaces and resource quotas enable efficient resource management in multi-tenant environments. Additionally, Kubernetes supports integration with various cloud providers and CI/CD tools, making it a versatile choice for modern DevOps practices. By mastering Kubernetes, you can improve the reliability, scalability, and maintainability of your containerized applications.;introduction to-kubernetes;kubernetes.png;1;49;2024:05:02 08:10;2024:05:02 08:10
40;12;5;Protecting Against SQL Injection;Understand how to protect your web applications against SQL injection attacks. SQL injection is a code injection technique that exploits a vulnerability in an application's software by manipulating SQL queries. Attackers can use SQL injection to gain unauthorized access to the database, retrieve sensitive information, and execute administrative operations. To protect against SQL injection, use prepared statements and parameterized queries, which ensure that SQL code is treated as data, not executable commands. Additionally, validate and sanitize user inputs to prevent malicious data from entering the system. Implementing proper error handling and using web application firewalls (WAFs) can further enhance security by detecting and blocking malicious activities.;protecting-against-sql-injection;sql-injection.jpg;1;77;2024:05:08 11:45;2024:05:08 11:45
41;4;10;Scaling Databases with NoSQL;Learn how to scale your applications using NoSQL databases effectively. NoSQL databases are designed to handle large volumes of unstructured data and provide horizontal scalability. By distributing data across multiple servers, NoSQL databases can manage high traffic and large datasets more efficiently than traditional relational databases. Techniques such as sharding, replication, and partitioning are commonly used to achieve scalability in NoSQL databases. Understanding the strengths and limitations of different NoSQL databases, such as document stores, key-value stores, and column-family stores, helps in choosing the right database for your application's needs. Implementing best practices for data modeling and indexing can also improve performance and ensure efficient data retrieval.;scaling-databases-with-nosql;nosql-scaling.jpg;1;99;2024:05:10 10:32;2024:05:10 11:20
42;4;7;Advanced Accessibility Features;Implement advanced accessibility features to make your website usable for everyone. Web accessibility ensures that people with disabilities can perceive, understand, navigate, and interact with web content. Advanced accessibility features include using ARIA (Accessible Rich Internet Applications) attributes to enhance the accessibility of dynamic content and user interface components. Providing keyboard navigation and focus management allows users with motor impairments to navigate the website using keyboard shortcuts. Additionally, implementing features such as screen reader compatibility, color contrast adjustments, and text resizing options can improve the user experience for individuals with visual impairments. Regularly conducting accessibility audits and following the Web Content Accessibility Guidelines (WCAG) helps ensure compliance and identify areas for improvement.;advanced-accessibility-features;accessibility-advanced.jpg;1;58;2024:05:13 16:30;2024:05:13 16:30
43;32;14;Building REST APIs with Flask;Flask is a micro web framework written in Python. Learn how to build RESTful APIs with Flask. Flask provides a lightweight and flexible framework for developing web applications and APIs. It allows developers to define routes, handle requests, and return responses using simple and intuitive syntax. Flask's modular design makes it easy to extend and integrate with other libraries and tools, such as SQLAlchemy for database interactions and Marshmallow for data serialization and validation. Building RESTful APIs with Flask involves creating endpoints for different HTTP methods, such as GET, POST, PUT, and DELETE, and implementing authentication and authorization mechanisms to secure the API. By mastering Flask, you can create robust and scalable APIs for your web applications.;building-rest-apis-with-flask;flask.jpg;1;95;2024:05:15 17:11;2024:05:15 18:44
44;38;1;Object-Oriented Programming in PHP;Master object-oriented programming (OOP) principles in PHP. Object-oriented programming is a programming paradigm that uses objects to represent and manipulate data. In PHP, OOP principles such as encapsulation, inheritance, and polymorphism help in organizing code and promoting code reusability. Encapsulation involves bundling data and methods that operate on that data within a single unit, or class, and restricting access to some of the object's components. Inheritance allows classes to inherit properties and methods from other classes, facilitating code reuse and reducing redundancy. Polymorphism enables objects of different classes to be treated as objects of a common superclass, allowing for flexibility and extensibility in code design. By mastering OOP principles in PHP, you can create more maintainable and scalable applications.;object-oriented-programming-in-php;php-oop.jpg;1;91;2024:05:20 16:45;2024:05:20 16:45
45;28;9;Async/Await in JavaScript;Master async/await syntax in JavaScript to write cleaner asynchronous code. The async/await syntax simplifies working with asynchronous operations by allowing you to write asynchronous code that looks and behaves like synchronous code. The async keyword is used to declare an asynchronous function, while the await keyword is used to pause the execution of the function until a Promise is resolved. This approach eliminates the need for chaining .then() and .catch() methods, resulting in more readable and maintainable code. Using async/await helps in handling errors more effectively with try/catch blocks and simplifies complex asynchronous workflows. Understanding how to use async/await in conjunction with other asynchronous patterns, such as Promises and callbacks, enhances your ability to build responsive and performant web applications.;async-await-javascript;async-await.png;1;81;2024:05:22 16:45;2024:05:22 16:45
46;6;2;Mastering Git for Version Control;Git is a distributed version control system that allows developers to track changes, collaborate with others, and manage codebases efficiently. Learn how to use Git for effective version control in your projects. Git enables developers to create branches for developing features, fixing bugs, and experimenting with new ideas without affecting the main codebase. By using pull requests and code reviews, teams can ensure code quality and maintain consistency. Understanding commands like merge, rebase, and cherry-pick helps in managing the commit history and resolving conflicts. Implementing a branching strategy, such as Git Flow or GitHub Flow, facilitates structured development and release processes. Integrating Git with continuous integration (CI) tools automates testing and deployment, ensuring that code changes are thoroughly tested before being released to production.;mastering-git-for-version-control;git.jpg;1;69;2024:05:26 15:22;2024:05:26 15:22
47;10;3;Principles of Effective UX Design;User Experience (UX) design is all about creating products that provide meaningful and relevant experiences to users. Learn the principles of effective UX design to enhance user satisfaction. UX design involves understanding user needs, behaviors, and motivations through research and analysis. Creating user personas, journey maps, and wireframes helps in visualizing and planning the user experience. Usability testing and iterative design processes ensure that the product meets user expectations and identifies areas for improvement. Effective UX design focuses on accessibility, usability, and aesthetics, creating an intuitive and enjoyable user experience. By applying UX design principles, you can enhance user engagement, satisfaction, and retention.;principles-of-effective-ux-design;ux-design.jpg;1;25;2024:05:30 08:55;2024:05:30 08:55
48;23;4;Mastering CSS Grid Layout;The CSS Grid Layout module offers a grid-based layout system, with rows and columns, making it easier to design web pages without having to use floats and positioning. CSS Grid provides a two-dimensional layout method, allowing you to create complex and responsive layouts with ease. The grid container defines the grid structure, while the grid items are placed within this structure according to specified rules. CSS Grid properties such as grid-template-columns, grid-template-rows, and grid-gap enable you to define the size and spacing of grid tracks. Using grid areas, you can create named regions within the grid, simplifying the placement of elements. Combining CSS Grid with media queries allows for adaptive layouts that respond to different screen sizes and orientations. By mastering CSS Grid, you can create modern and flexible web designs that enhance the user experience.;mastering-css-grid-layout;css-grid.png;1;92;2024:06:04 14:38;2024:06:05 09:11
