id;user_id;category_id;title;post_content;slug_post;post_image;status_id;view_count;created_at_post;updated_at_post
1;33;14;Creating RESTful APIs with Express.js;Learn how to create RESTful APIs using Express.js, a popular Node.js framework. Express.js simplifies the process of building robust and scalable server-side applications by providing a thin layer of fundamental web application features. It allows developers to easily handle routes, requests, and responses, making it a preferred choice for developing APIs. Creating a RESTful API involves defining a clear and consistent interface for accessing and manipulating resources. With Express.js, you can set up routes to handle different HTTP methods like GET, POST, PUT, and DELETE, each corresponding to different CRUD (Create, Read, Update, Delete) operations. For instance, a GET request can be used to retrieve a list of resources or a specific resource, while a POST request can be used to create a new resource. One of the key benefits of using Express.js is its middleware architecture, which enables the addition of various functionalities to the request-handling pipeline. Middleware functions can be used for logging, authentication, error handling, and more. This modular approach helps in keeping the code clean and maintainable. Additionally, Express.js supports integration with various databases, such as MongoDB and MySQL, allowing for efficient data storage and retrieval. By leveraging the power of Express.js, you can build efficient and scalable APIs that serve as the backbone for modern web applications. Whether you're developing a simple CRUD application or a complex system with multiple services, Express.js provides the tools and flexibility needed to create APIs that meet your specific requirements.;creating-restful-apis-with-express;express.jpg;1;83;2023:06:10 14:15;2023:06:10 14:15
2;18;1;Understanding MVC in PHP;The Model-View-Controller (MVC) framework is an architectural pattern that separates an application into three main components. The Model represents the data and the business logic of the application. It directly manages the data, logic, and rules of the application. The View is the user interface of the application. It displays the data from the model to the user and sends user commands to the controller. The Controller acts as an intermediary between the Model and the View. It listens to the input from the View, processes it (using the Model), and returns the result to display on the View. By separating these concerns, MVC helps in organizing the code better and makes it easier to manage and scale applications. Developers can work on the different components independently, for example, one developer can work on the view logic while another works on the business logic in the model. This separation also makes it easier to test individual components.MVC is widely used in web development frameworks such as Ruby on Rails, ASP.NET MVC, and Laravel. Each of these frameworks implements the MVC pattern in its own way, but the core principle remains the same. Understanding MVC is fundamental for developers looking to build robust, maintainable web applications.;understanding-mvc-in-php;mvc.jpg;1;105;2023:06:12 10:41;2023:06:12 10:41
3;32;9;Mastering JavaScript Promises;"JavaScript promises are used to handle asynchronous operations. Learn how to effectively use them in your code. A promise in JavaScript is an object that represents the eventual completion (or failure) of an asynchronous operation and its resulting value. Promises provide a cleaner, more flexible alternative to the traditional callback approach, which can lead to deeply nested and hard-to-read code, often referred to as ""callback hell"". A promise can be in one of three states: pending, fulfilled, or rejected. When a promise is pending, it means the asynchronous operation has not completed yet. If the operation completes successfully, the promise is fulfilled, and if it fails, the promise is rejected. You can use .then() and .catch() methods to handle the fulfilled and rejected states, respectively. Using promises, you can chain multiple asynchronous operations together, improving the readability and maintainability of your code. Promises are now a fundamental part of JavaScript and are used extensively in modern JavaScript frameworks and libraries, such as React, Angular, and Vue.js.";mastering-javaScript-promises;promises.jpg;1;82;2023:06:25 11:04;2023:06:26 11:25
4;14;14;Exploring RESTful APIs;RESTful APIs are used to build web services that are lightweight, maintainable, and scalable. REST, which stands for Representational State Transfer, is an architectural style that defines a set of constraints and principles for creating web services. RESTful services are stateless and can use HTTP methods like GET, POST, PUT, DELETE to perform CRUD (Create, Read, Update, Delete) operations on resources. One of the main advantages of RESTful APIs is their simplicity and scalability. Since they use standard HTTP protocols, they can be easily consumed by any client that understands HTTP, including web browsers, mobile devices, and other web services. This makes RESTful APIs ideal for building distributed systems and microservices. RESTful APIs also benefit from being stateless, meaning each request from a client contains all the information the server needs to fulfill that request. This allows for better scalability, as the server does not need to keep track of the client state. Additionally, RESTful APIs can be easily versioned, allowing for continuous development and evolution without breaking existing clients.;exploring-restful-apis;rest.png;1;51;2023:07:05 15:36;2023:07:05 15:36
5;35;4;CSS Grid Layout;The CSS Grid Layout module offers a grid-based layout system, with rows and columns, making it easier to design web pages. CSS Grid is a two-dimensional layout system, meaning it can handle both columns and rows, unlike flexbox, which is a one-dimensional layout system. With CSS Grid, you can create complex layouts that are responsive and adaptable to different screen sizes with relative ease. One of the most powerful features of CSS Grid is the ability to create areas on the grid that span multiple rows and columns. This allows for greater flexibility in designing layouts, enabling developers to create intricate designs without the need for complex CSS hacks or JavaScript. CSS Grid also supports alignment and spacing of items, making it easier to create visually appealing layouts. CSS Grid is supported by all modern browsers, making it a reliable choice for new projects. It complements other layout methods like flexbox and traditional floats, giving developers a comprehensive toolkit for designing responsive web layouts. Learning CSS Grid can significantly enhance your ability to create modern, flexible, and visually stunning web designs.;css-grid-layout;grid.png;1;74;2023:07:18 16:56;2023:07:19 18:22
6;32;9;JavaScript ES6 Features;Explore the new features introduced in JavaScript ES6 and how to use them in your projects. ES6, also known as ECMAScript 2015, introduced many new features to the JavaScript language, significantly improving its functionality and usability. Some of the most notable features include arrow functions, template literals, destructuring assignments, and classes. Arrow functions provide a shorter syntax for writing functions and do not have their own this context, which makes them particularly useful for writing concise and readable code. Template literals allow for easier string interpolation and multi-line strings, reducing the need for complex concatenations. Destructuring assignments enable the extraction of values from arrays or properties from objects into distinct variables, simplifying the code. ES6 also introduced classes, providing a more straightforward syntax for creating objects and dealing with inheritance, making JavaScript feel more like traditional object-oriented languages. Additionally, ES6 added new built-in objects like Set and Map, as well as the Promise object, which makes it easier to work with asynchronous code. These new features have been widely adopted and are now considered essential knowledge for modern JavaScript development.;javascript-es6-features;es6.jpg;1;112;2023:07:20 19:00;2023:07:20 19:00
7;9;5;Implementing OAuth2;OAuth2 is an authorization framework that enables applications to obtain limited access to user accounts on an HTTP service. It works by delegating user authentication to the service that hosts the user account and authorizing third-party applications to access the user account. This is done without exposing the user's credentials, such as passwords, to the third-party application.OAuth2 is widely used for token-based authentication and authorization in web and mobile applications. It provides a secure way for applications to access resources on behalf of a user. OAuth2 defines several grant types, including authorization code, implicit, password, and client credentials, each suited to different use cases.Using OAuth2, developers can build secure APIs that allow third-party applications to interact with their services. This is commonly seen in social login implementations, where users can log into an application using their credentials from services like Google, Facebook, or Twitter. Understanding OAuth2 is crucial for developers working on applications that require secure access to user data and services.;implementing-oauth2;oauth2.jpg;1;66;2023:08:07 11:32;2023:08:08 09:25
8;38;1;Getting Started with PHP;"PHP, which stands for ""Hypertext Preprocessor,"" is a widely-used open-source scripting language that is especially suited for web development and can be embedded into HTML. PHP scripts are executed on the server, and the result is returned to the browser as plain HTML. This server-side execution allows PHP to perform dynamic content generation, database interactions, and session management. One of the strengths of PHP is its ease of use and simplicity. It has a shallow learning curve, making it accessible to beginners while offering powerful features for advanced users. PHP supports a wide range of databases, including MySQL, PostgreSQL, SQLite, and many others, providing flexibility in choosing the right database for your application. PHP is also highly extensible, with a vast ecosystem of libraries, frameworks, and tools. Frameworks like Laravel, Symfony, and CodeIgniter have become popular choices for building robust web applications, offering features such as routing, templating, and ORM (Object-Relational Mapping) out of the box. The large community and extensive documentation make PHP a reliable and versatile language for web development.";getting-started-with-php;php.jpg;1;35;2023:09:19 09:15;2023:09:19 09:15
9;28;9;Advanced Node.js Techniques;Enhance your Node.js applications with advanced techniques and best practices. Node.js is a runtime environment that allows you to execute JavaScript code on the server side. It is built on the V8 JavaScript engine, which is known for its high performance and efficiency. Node.js uses an event-driven, non-blocking I/O model, making it ideal for building scalable network applications. Advanced techniques in Node.js include using asynchronous programming patterns such as Promises and async/await to handle I/O operations efficiently. You can also leverage middleware frameworks like Express.js to manage routing, handle requests, and integrate with databases. Understanding how to use streams in Node.js can also help you process large amounts of data efficiently. Best practices for Node.js development include following a modular architecture, using environment variables for configuration, and implementing proper error handling and logging. By adhering to these practices, you can build robust, maintainable, and scalable Node.js applications that can handle a large number of simultaneous connections with high performance.;advanced-nodejs-techniques;nodejs.png;1;39;2023:09:25 14:35;2023:09:26 16:55
10;3;9;Understanding JavaScript Closures;"Closures are a fundamental concept in JavaScript that allow functions to retain access to their lexical scope, even when the function is executed outside that scope. This means that a closure can ""remember"" the environment in which it was created, which includes any variables that were in scope at the time. This powerful feature allows for more flexible and expressive code, enabling patterns such as function factories and private data encapsulation.Closures are often used in JavaScript for event handlers, callbacks, and immediately-invoked function expressions (IIFE). By leveraging closures, developers can create more modular and maintainable code, as they allow for the encapsulation of functionality and state. Additionally, closures are essential for creating higher-order functions, which are functions that return other functions or take functions as arguments.Understanding closures is crucial for mastering JavaScript, as they form the basis for many advanced programming techniques. They enable developers to write cleaner and more efficient code, making it easier to manage complex applications. By practicing and experimenting with closures, you can unlock the full potential of JavaScript and improve your coding skills.";understanding-js-closures;js-closures.png;1;70;2023:10:09 18:22;2023:10:09 18:22
11;32;10;Introduction to Database Management;Database Management involves the use of software to manage and organize data efficiently. Learn about different types of databases, SQL, and best practices for managing data. Databases are essential for storing and retrieving data in a structured way, allowing applications to function effectively. There are various types of databases, including relational databases like MySQL and PostgreSQL, and NoSQL databases like MongoDB and Cassandra.SQL (Structured Query Language) is the standard language used to interact with relational databases. It allows for querying, updating, and managing data, providing powerful tools for data manipulation. Best practices in database management include normalization, indexing, and using transactions to ensure data integrity. Proper database design and management can significantly improve the performance and scalability of applications.NoSQL databases offer flexible schema design, making them suitable for applications with varying data structures. They are often used in big data and real-time web applications due to their ability to handle large volumes of unstructured data. Understanding both SQL and NoSQL databases, and knowing when to use each, is key to effective database management.;introduction-to-database-management;database-management.jpg;1;110;2023:10:29 18:22;2023:10:30 12:10
12;1;3;Building Single Page Apps;Single Page Applications (SPAs) load a single HTML page and dynamically update as the user interacts with the app. SPAs provide a more fluid user experience by avoiding full page reloads and instead loading content asynchronously. This leads to faster interactions and a more app-like experience, which is particularly beneficial for web applications that require frequent user interactions.SPAs typically use JavaScript frameworks such as Angular, React, or Vue.js to manage the application's state and render components. These frameworks enable developers to build complex user interfaces that can react to user inputs in real-time. Additionally, SPAs often rely on RESTful APIs or GraphQL for data fetching, further enhancing their performance and scalability.One of the challenges with SPAs is ensuring that they are properly optimized for search engines and accessible to all users. Techniques such as server-side rendering (SSR) and code splitting can help address these issues, providing a better overall user experience. By mastering SPAs, developers can create highly interactive and efficient web applications.;single-page-apps;spa.png;1;42;2023:11:15 12:11;2023:11:15 12:11
13;9;3;Responsive Web Design;Responsive web design ensures that web applications render well on a variety of devices and window or screen sizes. This approach uses flexible layouts, fluid grids, and CSS media queries to adjust the design and layout based on the screen size, orientation, and resolution. The goal is to provide an optimal viewing experience, with easy reading and navigation across a wide range of devices, from desktop computers to mobile phones.A key principle of responsive design is the use of a mobile-first approach, where the design is initially optimized for smaller screens and then enhanced for larger screens. This ensures that the core content and functionality are accessible on all devices, with additional features and styles applied as the screen size increases. Responsive design also involves optimizing images, typography, and touch-friendly elements to improve the overall user experience.Flexbox and CSS Grid are powerful tools for creating responsive layouts, allowing for the efficient arrangement of elements within a container. By combining these techniques with best practices in responsive design, developers can create web applications that are both visually appealing and highly functional on any device.;responsive-web-design;responsive.jpg;1;95;2023:11:26 09:29;2023:11:26 09:29
14;3;14;GraphQL Basics;GraphQL is a query language for APIs and a runtime for executing those queries by using a type system you define for your data. Unlike RESTful APIs, where each endpoint returns a fixed structure of data, GraphQL allows clients to request exactly the data they need, reducing over-fetching and under-fetching of data. This flexibility makes it easier to evolve APIs over time without breaking existing clients.GraphQL queries mirror the shape of the JSON data they return, making it intuitive for developers to work with. The type system ensures that the queries are valid and that the responses conform to the specified schema. This strong typing helps catch errors early in the development process and improves the overall robustness of the API.GraphQL also supports real-time data updates through subscriptions, which allow clients to receive updates when the data they are interested in changes. This is particularly useful for applications that require real-time notifications or live data feeds. By adopting GraphQL, developers can create more efficient and flexible APIs that meet the specific needs of their applications.;graphql-basics;graphql.jpg;1;12;2023:12:08 08:30;2023:12:08 08:30
15;20;5;Securing Web Applications;Security is a critical aspect of web development. Learn how to secure your web applications. Protecting sensitive data and ensuring the integrity and availability of web services are paramount concerns for developers. Common security threats include SQL injection, cross-site scripting (XSS), cross-site request forgery (CSRF), and data breaches. Implementing best practices for web security helps mitigate these risks.One fundamental practice is to validate and sanitize user inputs to prevent malicious data from being processed by the application. Using prepared statements and parameterized queries can protect against SQL injection attacks. Implementing secure authentication and authorization mechanisms ensures that only authorized users can access certain resources or perform specific actions.Encrypting sensitive data, both at rest and in transit, helps protect it from unauthorized access. Additionally, regularly updating software and dependencies to patch known vulnerabilities, using security headers, and conducting security audits and penetration testing can further enhance the security of web applications. By prioritizing security, developers can build resilient applications that protect users and data from potential threats.;securing-web-applications;security.jpg;1;88;2023:12:21 13:39;2023:12:21 13:39
16;3;11;Performance Tuning Tips;Discover tips and techniques for tuning the performance of your web applications. Optimizing performance is essential for providing a fast and responsive user experience, which can lead to higher user engagement and satisfaction. Key performance areas include reducing page load times, optimizing server response times, and improving the efficiency of client-side scripts.One effective technique is to minimize HTTP requests by combining CSS and JavaScript files, using CSS sprites for images, and implementing lazy loading for non-critical resources. Compressing files using Gzip or Brotli can also reduce the size of transferred data, speeding up load times. Additionally, leveraging browser caching can help improve performance by storing static resources locally on the user's device.Optimizing images, using responsive images, and implementing image compression techniques can significantly reduce the load time. On the server side, optimizing database queries, using content delivery networks (CDNs), and implementing server-side caching strategies can improve response times. Monitoring and analyzing performance metrics using tools like Google Lighthouse, WebPageTest, and performance profiling tools can help identify and address performance bottlenecks.;performance-tuning-tips;performance-tuning.jpg;1;38;2024:01:02 09:11;2024:01:02 09:11
17;4;15;Deploying with Docker;"Docker allows you to automate the deployment of applications inside lightweight, portable containers. Containers package an application and its dependencies into a single, isolated unit that can run consistently across different environments. This ensures that applications behave the same way in development, testing, and production, reducing the ""it works on my machine"" problem.Using Docker, developers can create consistent development environments, streamline CI/CD pipelines, and simplify dependency management. Docker images are versioned and can be shared through registries like Docker Hub, enabling easy collaboration and distribution of applications. By using Docker Compose, developers can define and manage multi-container applications, specifying how different services interact with each other.Docker also integrates with orchestration tools like Kubernetes, allowing for the automated deployment, scaling, and management of containerized applications. This makes it easier to handle the complexity of deploying applications in a distributed system, ensuring high availability and scalability. By adopting Docker, developers can improve the efficiency and reliability of their deployment processes.";deploying-with-docker;docker.png;1;48;2024:01:10 12:06;2024:01:10 15:53
18;14;12;Introduction to React;React is a JavaScript library for building user interfaces. Learn the basics and get started with React. Developed and maintained by Facebook, React has become one of the most popular libraries for building dynamic and interactive web applications. Its component-based architecture allows developers to break down complex UIs into reusable, self-contained pieces, making the development process more efficient and maintainable.React uses a virtual DOM to optimize rendering performance. When the state of a component changes, React updates the virtual DOM and then calculates the most efficient way to apply these changes to the actual DOM. This approach minimizes the number of expensive DOM operations and improves the overall performance of the application.React also supports server-side rendering (SSR), which can improve the initial load time and SEO of web applications. By understanding the core concepts of React, such as components, props, state, and lifecycle methods, developers can create powerful and scalable web applications. The React ecosystem, including tools like React Router and Redux, further enhances the capabilities of React for building complex applications.;introduction-to-react;react.png;1;62;2024:01:15 16:42;2024:01:15 18:33
19;20;6;Creating Custom WordPress Themes;Learn how to create custom themes for WordPress to tailor your site to your needs. Custom themes allow you to define the look and feel of your WordPress site, providing a unique user experience. Understanding the WordPress theme hierarchy is essential for creating custom themes. This hierarchy determines which template files are used to display different types of content. By creating and modifying template files, you can control the layout and design of your site. Additionally, using functions.php, you can add custom functionality and features to your theme. WordPress hooks, including actions and filters, provide a way to interact with the core functionality without modifying the core files, ensuring your customizations are update-safe.;creating-custom-wordpress-themes;wp-themes.jpg;1;131;2024:01:23 11:42;2024:01:23 11:42
20;27;12;Building Interactive UIs with React Hooks;Use React Hooks to build more interactive and efficient user interfaces. React Hooks provide a way to use state and other React features in functional components. The useState hook allows you to add state to functional components, enabling them to manage and respond to user interactions. The useEffect hook lets you perform side effects, such as data fetching or subscriptions, in functional components. By using hooks, you can avoid the complexities of class components and create cleaner, more readable code. Additionally, custom hooks allow you to extract and reuse logic across multiple components, promoting code reuse and separation of concerns. Hooks have become an essential part of React development, enabling developers to build powerful and maintainable user interfaces.;building-interactive-uis-with-react-hooks;react-hooks.png;1;98;2024:01:26 13:10;2024:01:26 13:10
